{
  "$schema": "https://raw.githubusercontent.com/LILYGO-UI/packages/main/registry-release.schema.json",
  "schema_version": 1,
  "status": "published",
  "submitted_by": "lbuque",
  "manifest": {
    "$schema": "https://raw.githubusercontent.com/LILYGO-UI/packages/main/publish.schema.json",
    "schema_version": 1,
    "package": "lilygo-ui-youtube",
    "version": "0.1.1",
    "app_id": "cc.lilygo.ui.YouTube",
    "title": "YouTube",
    "summary": "Search and watch YouTube on LILYGO devices",
    "description": "A standalone YouTube client with native search and video playback.",
    "authors": [
      {
        "name": "lbuque",
        "email": "110239031@qq.com"
      }
    ],
    "categories": [
      "Multimedia"
    ],
    "license": "MIT",
    "source_repo": "https://github.com/LILYGO-UI/template",
    "homepage": "https://github.com/LILYGO-UI/template",
    "assets": {
      "icon": "assets/sha256/9d/9d979c172fbb95a126b9059bb08a3e7306810331d623e066f558a1b5dd973714.png",
      "screenshots": [
        {
          "path": "assets/sha256/ca/ca4e7e96a16b9745eff1d7d2b008a4706284aeabb63e668530e5e3d58a911254.png",
          "caption": "Native YouTube video playback"
        }
      ]
    },
    "permissions": [
      {
        "id": "network",
        "reason": "Access online application data"
      },
      {
        "id": "filesystem",
        "reason": "Store application settings",
        "access": "read-write",
        "scope": "app-data"
      }
    ],
    "compatibility": {
      "architectures": [
        "arm64"
      ],
      "min_appkit_version": "0.1.0"
    },
    "launcher": {
      "order": 90
    }
  },
  "artifact": {
    "architecture": "arm64",
    "size": 1215864,
    "sha256": "3694c6d76aced71484f1f3bf5bfdb6dbb75a8b3da7932017d5097a0b26d18f76",
    "media_type": "application/vnd.debian.binary-package",
    "source": {
      "repository": "lbuque/packages",
      "tag": "lpm-staging-lilygo-ui-youtube-0.1.1-3694c6d76ace",
      "asset": "sha256-3694c6d76aced71484f1f3bf5bfdb6dbb75a8b3da7932017d5097a0b26d18f76.deb",
      "url": "https://github.com/lbuque/packages/releases/download/lpm-staging-lilygo-ui-youtube-0.1.1-3694c6d76ace/sha256-3694c6d76aced71484f1f3bf5bfdb6dbb75a8b3da7932017d5097a0b26d18f76.deb"
    },
    "central": {
      "repository": "LILYGO-UI/packages",
      "tag": "apt-pool-lilygo-ui-youtube",
      "asset": "sha256-3694c6d76aced71484f1f3bf5bfdb6dbb75a8b3da7932017d5097a0b26d18f76.deb",
      "url": "https://github.com/LILYGO-UI/packages/releases/download/apt-pool-lilygo-ui-youtube/sha256-3694c6d76aced71484f1f3bf5bfdb6dbb75a8b3da7932017d5097a0b26d18f76.deb"
    }
  }
}
