{
  "$schema": "https://raw.githubusercontent.com/LILYGO-UI/packages/main/registry-release.schema.json",
  "schema_version": 1,
  "status": "published",
  "submitted_by": "lbuque",
  "manifest": {
    "$schema": "https://raw.githubusercontent.com/LILYGO-UI/packages/main/publish.schema.json",
    "schema_version": 1,
    "package": "lilygo-ui-settings",
    "version": "0.1.1",
    "app_id": "cc.lilygo.ui.Settings",
    "title": "Settings",
    "summary": "Configure networking, SSH sharing, serial console, keyboard vibration, power, and device settings.",
    "description": "The system Settings application for LILYGO UI devices, providing Wi-Fi, Bluetooth, Ethernet, cellular radio and SIM information with available modem data statistics, battery capacity calibration and charging limits, keyboard vibration, SSH remote login, serial console, and device information controls.",
    "authors": [
      {
        "name": "LILYGO",
        "github": "LILYGO"
      }
    ],
    "categories": [
      "System",
      "Utilities"
    ],
    "license": "LicenseRef-proprietary",
    "source_repo": "https://github.com/LILYGO-UI/settings",
    "homepage": "https://github.com/LILYGO-UI/settings",
    "assets": {
      "icon": "assets/sha256/79/799049df6393287064d6024108c77b8824d993b8a5b65e75c100a695478c1a24.png",
      "screenshots": [
        {
          "path": "assets/sha256/52/525d2320051dc7001b54cfbf5a0b89b48858a8a432e34e08ae1ff70300e8f626.png",
          "caption": "Settings categories and current device status."
        },
        {
          "path": "assets/sha256/18/18607ac2b721b85bf6bf7b0c31a2dbfd57f8095096476583d555b5521dd324d2.png",
          "caption": "Wi-Fi with the current connection, known networks, and nearby networks."
        },
        {
          "path": "assets/sha256/46/46fd7e1bbb4b0c8178fad2078fa5587b0b9c77606c5386945de04a2763970f17.png",
          "caption": "Current Wi-Fi connection details with IPv4 and IPv6 information."
        },
        {
          "path": "assets/sha256/d5/d5a06223ab912083ab00b51f648815c7372b845dcfd1b46b7ca31695d2fd8bbc.png",
          "caption": "Wi-Fi DNS servers and search domains."
        },
        {
          "path": "assets/sha256/8b/8b3e2963176f5bee7892623a9ec83f7ee8fe9eedc68eb4108c362deb935d9516.png",
          "caption": "Wi-Fi interface, MAC address, and MTU."
        },
        {
          "path": "assets/sha256/f4/f4a3e334a654f20a98bdd09bff9fe48dba4b43b2061b4671a2c9ec86072d1a9f.png",
          "caption": "Cellular radio, SIM information, registration status, and available modem data statistics."
        },
        {
          "path": "assets/sha256/36/36f35e4dc4022ff3f303ad8debc7aab21870b71b1de02957aecfe4ac80829c00.png",
          "caption": "Cellular in the responsive landscape settings view."
        },
        {
          "path": "assets/sha256/ea/eace47e63ef6f88b1ce6e279fbae71e954fea22fbdba99eb9adf3185ba348876.png",
          "caption": "General > Sharing with SSH remote login and serial console controls."
        },
        {
          "path": "assets/sha256/8e/8eef260ded9e1bf0ddbac8c73458eccddfabe57e811b5da98855b08680303840.png",
          "caption": "Sharing in the responsive landscape settings view."
        },
        {
          "path": "assets/sha256/73/73a6ce9deb48112a2500a39d12eba31b62e1b4811b59b24ffe0b7aaad6f1426a.png",
          "caption": "Restart now or later after saving Serial Console settings."
        },
        {
          "path": "assets/sha256/8e/8e9960da406bcffb751da792cbfad05adb1b7e2180c25fe55c2b68898d59d2e4.png",
          "caption": "Battery telemetry and capacity calibration."
        },
        {
          "path": "assets/sha256/63/63f61882d95c0d4614808d147cafdadc9ebdc545e0fbd2985aa6246bb5ca4c0c.png",
          "caption": "Confirm design and full-charge capacities before saving."
        },
        {
          "path": "assets/sha256/33/337037b8e66b70a2a7564a7db2d11ad46395a037ec05039a8ccf1c698e87637a.png",
          "caption": "BQ25890 input and charge current controls."
        }
      ]
    },
    "permissions": [
      {
        "id": "network",
        "reason": "Inspect networking; allow existing administrator users to join or forget Wi-Fi networks and toggle SSH through narrowly authorized system commands."
      },
      {
        "id": "bluetooth",
        "reason": "Inspect, enable, pair, and disconnect Bluetooth devices through BlueZ."
      },
      {
        "id": "serial",
        "reason": "Access the nRF9151 cellular module through /dev/ttyACM0 to control LTE and read SIM, registration, signal, and available modem data statistics using the user's operating-system serial permissions; allow existing administrator users to save serial console settings and restart after confirmation through narrowly authorized commands."
      },
      {
        "id": "i2c",
        "reason": "Read fuel gauge telemetry and allow administrator users to calibrate BQ27220 capacities and set BQ25890 current limits through a restricted helper."
      }
    ],
    "compatibility": {
      "architectures": [
        "arm64"
      ],
      "min_appkit_version": "0.1.0"
    },
    "launcher": {
      "order": 35
    }
  },
  "artifact": {
    "architecture": "arm64",
    "size": 1403696,
    "sha256": "429e1f2fc4eec8a9e83be641fcb8f1a78a58cecd9c4e35433cac24887d9887dc",
    "media_type": "application/vnd.debian.binary-package",
    "source": {
      "repository": "lbuque/packages",
      "tag": "lpm-staging-lilygo-ui-settings-0.1.1-429e1f2fc4ee",
      "asset": "sha256-429e1f2fc4eec8a9e83be641fcb8f1a78a58cecd9c4e35433cac24887d9887dc.deb",
      "url": "https://github.com/lbuque/packages/releases/download/lpm-staging-lilygo-ui-settings-0.1.1-429e1f2fc4ee/sha256-429e1f2fc4eec8a9e83be641fcb8f1a78a58cecd9c4e35433cac24887d9887dc.deb"
    },
    "central": {
      "repository": "LILYGO-UI/packages",
      "tag": "apt-pool-lilygo-ui-settings",
      "asset": "sha256-429e1f2fc4eec8a9e83be641fcb8f1a78a58cecd9c4e35433cac24887d9887dc.deb",
      "url": "https://github.com/LILYGO-UI/packages/releases/download/apt-pool-lilygo-ui-settings/sha256-429e1f2fc4eec8a9e83be641fcb8f1a78a58cecd9c4e35433cac24887d9887dc.deb"
    }
  }
}
