{
  "$schema": "https://raw.githubusercontent.com/LILYGO-UI/packages/main/registry-release.schema.json",
  "schema_version": 1,
  "status": "published",
  "submitted_by": "lbuque",
  "manifest": {
    "$schema": "https://raw.githubusercontent.com/LILYGO-UI/packages/main/publish.schema.json",
    "schema_version": 1,
    "package": "lilygo-ui-launcher",
    "version": "0.1.2-rc2",
    "app_id": "cc.lilygo.ui.Launcher",
    "title": "Launcher",
    "summary": "System application launcher for LILYGO Linux products.",
    "description": "The primary LILYGO UI shell for discovering and launching installed applications on LILYGO Linux products.",
    "authors": [
      {
        "name": "LILYGO",
        "email": "110239031@qq.com",
        "github": "LILYGO"
      }
    ],
    "categories": [
      "System"
    ],
    "license": "LicenseRef-proprietary",
    "source_repo": "https://github.com/LILYGO-UI/launcher",
    "homepage": "https://github.com/LILYGO-UI/launcher",
    "assets": {
      "icon": "assets/sha256/a8/a822f9e77ffbcf4b55b03d0b61a898d3216289d6f03a1a70387a2d6e29f99a41.png",
      "screenshots": [
        {
          "path": "assets/sha256/71/71a4dd38f7b553ea31887b4d27b7cfba5c3d5e1e2eed24586504c50859f92495.png",
          "caption": "Launcher home screen in portrait orientation."
        },
        {
          "path": "assets/sha256/39/3933baed0a5d711a59c68c1740843173d4d14f24ce58cf967d13bd00ebcd87d6.png",
          "caption": "Launcher home screen in landscape orientation."
        }
      ]
    },
    "permissions": [
      {
        "id": "background-service",
        "reason": "Run as the primary system UI and manage application processes."
      },
      {
        "id": "filesystem",
        "reason": "Discover installed application manifests and icons.",
        "access": "read",
        "scope": "shared-data"
      },
      {
        "id": "external-display",
        "reason": "Drive the device display directly through DRM/KMS."
      }
    ],
    "compatibility": {
      "architectures": [
        "arm64"
      ],
      "min_appkit_version": "0.1.0"
    },
    "launcher": {
      "order": 0
    }
  },
  "artifact": {
    "architecture": "arm64",
    "size": 1304012,
    "sha256": "7b6d45e0dc82f4c32cc17e398d4d9ea017d97b3c38469601318885a63ce2c787",
    "media_type": "application/vnd.debian.binary-package",
    "source": {
      "repository": "lbuque/packages",
      "tag": "lpm-staging-lilygo-ui-launcher-0.1.2-rc2-7b6d45e0dc82",
      "asset": "sha256-7b6d45e0dc82f4c32cc17e398d4d9ea017d97b3c38469601318885a63ce2c787.deb",
      "url": "https://github.com/lbuque/packages/releases/download/lpm-staging-lilygo-ui-launcher-0.1.2-rc2-7b6d45e0dc82/sha256-7b6d45e0dc82f4c32cc17e398d4d9ea017d97b3c38469601318885a63ce2c787.deb"
    },
    "central": {
      "repository": "LILYGO-UI/packages",
      "tag": "apt-pool-lilygo-ui-launcher",
      "asset": "sha256-7b6d45e0dc82f4c32cc17e398d4d9ea017d97b3c38469601318885a63ce2c787.deb",
      "url": "https://github.com/LILYGO-UI/packages/releases/download/apt-pool-lilygo-ui-launcher/sha256-7b6d45e0dc82f4c32cc17e398d4d9ea017d97b3c38469601318885a63ce2c787.deb"
    }
  }
}
