{
  "$schema": "https://raw.githubusercontent.com/LILYGO-UI/packages/main/registry-release.schema.json",
  "schema_version": 1,
  "status": "published",
  "submitted_by": "lbuque",
  "manifest": {
    "$schema": "https://raw.githubusercontent.com/LILYGO-UI/packages/main/publish.schema.json",
    "schema_version": 1,
    "package": "lilygo-ui-i2cdetector",
    "version": "0.1.1",
    "app_id": "cc.lilygo.ui.I2cDetector",
    "title": "I2C Detector",
    "summary": "Scan Linux I2C buses and inspect detected 7-bit addresses",
    "description": "Asynchronously scans available Linux I2C buses and highlights detected devices in a 7-bit address map.",
    "authors": [
      {
        "name": "lbuque",
        "email": "110239031@qq.com"
      }
    ],
    "categories": [
      "Development"
    ],
    "license": "MIT",
    "source_repo": "https://github.com/LILYGO-UI/lilygo-ui-i2cdetector",
    "homepage": "https://github.com/LILYGO-UI/lilygo-ui-i2cdetector",
    "assets": {
      "icon": "assets/sha256/f4/f4b6d440c08bdaf8659cc33abd942e7b7afd02fa263a74d522d73d25c50bd18e.png",
      "screenshots": [
        {
          "path": "assets/sha256/0a/0a0c82122ccd5281ed32a3241b180ea95206dd91da0b554adf407c9eb2f70e36.png",
          "caption": "Detected devices highlighted in the 7-bit I2C address map"
        }
      ]
    },
    "permissions": [
      {
        "id": "i2c",
        "reason": "Discover I2C adapters and probe connected 7-bit devices."
      }
    ],
    "compatibility": {
      "architectures": [
        "arm64"
      ],
      "min_appkit_version": "0.1.0"
    },
    "launcher": {
      "order": 90
    }
  },
  "artifact": {
    "architecture": "arm64",
    "size": 1089506,
    "sha256": "0d8127a78c9ac5aff1a2c3e461773963c8ef7320c0a91c921c0846c507a0a2c5",
    "media_type": "application/vnd.debian.binary-package",
    "source": {
      "repository": "lbuque/packages",
      "tag": "lpm-staging-lilygo-ui-i2cdetector-0.1.1-0d8127a78c9a",
      "asset": "sha256-0d8127a78c9ac5aff1a2c3e461773963c8ef7320c0a91c921c0846c507a0a2c5.deb",
      "url": "https://github.com/lbuque/packages/releases/download/lpm-staging-lilygo-ui-i2cdetector-0.1.1-0d8127a78c9a/sha256-0d8127a78c9ac5aff1a2c3e461773963c8ef7320c0a91c921c0846c507a0a2c5.deb"
    },
    "central": {
      "repository": "LILYGO-UI/packages",
      "tag": "apt-pool-lilygo-ui-i2cdetector",
      "asset": "sha256-0d8127a78c9ac5aff1a2c3e461773963c8ef7320c0a91c921c0846c507a0a2c5.deb",
      "url": "https://github.com/LILYGO-UI/packages/releases/download/apt-pool-lilygo-ui-i2cdetector/sha256-0d8127a78c9ac5aff1a2c3e461773963c8ef7320c0a91c921c0846c507a0a2c5.deb"
    }
  }
}
